{
  "quick_take": {
    "one_line": "Remote work ecosystems reshape regional economies by 2030.",
    "bullets": [
      "Hybrid hubs outcompete HQ-centric models",
      "Talent arbitrage equalizes wages across cities",
      "Micrologistics supports local maker clusters",
      "AI copilots increase solo founder throughput",
      "Regulators tax virtual presence for services",
      "Wellness infrastructure becomes a benefit staple"
    ],
    "confidence": "med",
    "assumptions": [
      "Knowledge work remains a sizable share of GDP",
      "Broadband coverage continues to improve"
    ]
  },
  "cones": [
    {
      "name": "Upside",
      "vignette": "Regional innovation districts thrive as talent disperses and civic tech keeps services responsive.",
      "drivers": [
        "Affordable housing in secondary cities",
        "Persistent climate migration",
        "Corporate tax incentives for remote teams"
      ],
      "uncertainties": [
        "Unionization of remote-first workers",
        "Cross-border employment compliance"
      ],
      "early_signals": ["New visa classes for remote contributors"]
    },
    {
      "name": "Downside",
      "vignette": "Fragmented services and digital divides widen inequities despite nominal flexibility promises.",
      "drivers": [
        "Stalled broadband investment",
        "Return-to-office backlash from managers",
        "Escalating cybersecurity insurance costs"
      ],
      "uncertainties": [
        "Civic pushback on transient residents",
        "Automation hitting mid-level coordinators first"
      ],
      "early_signals": ["Spike in co-working defaults in tier-2 cities"]
    }
  ],
  "signals_drivers": {
    "signals": [
      {
        "title": "IRS updates remote taxation guidance",
        "summary": "Clarifies nexus for interstate remote employees",
        "source_url": null
      },
      { "title": "Starlink price drop", "summary": "Cheaper rural coverage", "source_url": null },
      { "title": "Rise of async-first playbooks", "summary": "Teams codify rituals", "source_url": null },
      { "title": "Micromobility boom", "summary": "Suburban last-mile options expand", "source_url": null },
      { "title": "AI HR copilots", "summary": "Personalized policy guidance", "source_url": null },
      { "title": "Portable benefits pilots", "summary": "States experiment with benefit wallets", "source_url": null }
    ],
    "drivers": [
      { "name": "Labor flexibility demand", "why": "Workers prioritize autonomy" },
      { "name": "Cloud collaboration maturity", "why": "Tooling reduces friction" },
      { "name": "Urban cost pressure", "why": "Housing remains expensive" },
      { "name": "Climate adaptation spend", "why": "Cities fund resilient infrastructure" }
    ]
  },
  "timeline": {
    "milestones": [
      { "when": "2025", "what": "Federal remote work standards", "so_what": "Predictable compliance" },
      { "when": "2027", "what": "Portable benefits mainstreamed", "so_what": "Talent mobility accelerates" },
      { "when": "2030", "what": "Equalized wage bands", "so_what": "Regional cost convergence" }
    ],
    "inflections": [
      { "when": "2026", "what": "AI-led compliance automation adopted" }
    ]
  },
  "moves": {
    "no_regrets": [
      "Invest in async collaboration standards",
      "Expand remote security training",
      "Pilot stipends for home office ergonomics"
    ],
    "options": [
      "Acquire niche co-working network",
      "Launch regional micro-hubs program"
    ],
    "watch_outs": ["Jurisdictional compliance fines"],
    "tags": [
      { "effort": "M", "impact": "H" },
      { "effort": "L", "impact": "M" }
    ]
  }
}
